"entry_id","post_title","post_content","footnotes","post_date"
"534","Why a New Study of the Mariel Boatlift Has Not Changed Our Views on the Benefits of Immigration","<p>As&nbsp;a consultant for the Open Philanthropy Project last year, I <a href=""http://davidroodman.com/blog/2014/09/03/the-domestic-economic-impacts-of-immigration/"">reviewed</a> the research on whether immigration reduces employment or earnings&nbsp;for workers in receiving countries. I concluded that for&nbsp;natives&nbsp;the harm, if any, is small.</p>

<p>Last month the&nbsp;prominent immigration researcher <a href=""http://www.hks.harvard.edu/fs/gborjas/"">George Borjas</a>&nbsp;posted&nbsp;a <a href=""https://web.archive.org/web/20151007165844/http://www.hks.harvard.edu/fs/gborjas/publications/working%20papers/Mariel2015.pdf"">challenge</a>&nbsp;to a&nbsp;seminal study in my review. His new paper&nbsp;contends that the Mariel boatlift, which brought&nbsp;some 60,000&nbsp;Cuban refugees to&nbsp;Miami in 1980, <em>did</em> profoundly affect the labor market there, depressing wages for low-education men&nbsp;(ones with&nbsp;less than a high school education)&nbsp;by 10-30%.</p>

<p>Borjas&#39;s work is especially significant because it seems&nbsp;to upend&nbsp;a <a href=""http://davidcard.berkeley.edu/papers/mariel-impact.pdf"">study of the boatlift</a>&nbsp;published&nbsp;by <a href=""https://www.econ.berkeley.edu/faculty/808"">David Card</a>&nbsp;25 years ago, which found little impact of all that immigration on workers in Miami. Interestingly, Borjas, who emphasizes the harm of Cuban immigration, is himself a <a href=""https://en.wikipedia.org/wiki/George_J._Borjas#Personal_life_and_education"">Cuban emigr&eacute;</a>.</p>

<p>I probed this dispute, replicating and checking the results in the dueling papers. I&nbsp;ultimately found little cause&nbsp;to change my views.&nbsp;The main reasons:</p>

<ul>
	<li>Of the two Census Bureau data sets that Borjas relies on, the one with&nbsp;larger samples shows smaller impacts.</li>
	<li>According to that data set, wages for women, which&nbsp;Borjas excludes,&nbsp;<em>rose</em>, if anything,&nbsp;after immigration spikes (especially after a second one in 1994&ndash;95).</li>
	<li>I see no&nbsp;sharp breaks from&nbsp;long-term trends of the sort that could be confidently&nbsp;attributed to the 1980&nbsp;immigration surge. The Borjas analysis appears correct that&nbsp;wages for low-education Miami men (defined henceforth as those with less than a high school education) were lower on average in 1981-83 than in 1977-79 &ndash; with the drop being larger than in most other US cities. But the data argue more for&nbsp;a steady long-term decline than&nbsp;sudden drops after immigration surges. The Borjas analysis tends to obscure this distinction by aggregating or smoothing data over several years.</li>
	<li>The original study by David Card is one of 17 covered in&nbsp;my review, including three&nbsp;others exploiting&nbsp;natural experiments in mass migration. None of the studies is as compelling as a randomized trial, but the overall picture &ndash; of at most modest harm from substantial immigration &ndash; does not change if the Card study is removed.</li>
</ul>

<p>Details&nbsp;follow. <!--more--></p>

<h2>Background</h2>

<p>In my <a href=""http://davidroodman.com/blog/2014/09/03/the-domestic-economic-impacts-of-immigration"">evidence review</a>&nbsp;on the impacts of immigration in receiving countries, I wrote:</p>

<blockquote>There is almost no evidence of anything close to one-to-one crowding out by new immigrant arrivals to the job market in industrial countries. Most studies find that 10 percentage point increase in the immigrant &ldquo;stock&rdquo; as a share of the labor force changes natives&rsquo; earnings by between &ndash;2% and +2% (Longhi, Nijkamp, and Poot 2005, Fig 1; Peri 2014, Pg 1). Although serious questions can be raised about the reliability of most studies, the scarcity of evidence for great pessimism stands as a fact. The economies of destination countries largely appear flexible enough to absorb new arrivals, especially given time.</blockquote>

<p>I&nbsp;based that&nbsp;conclusion in substantial part on&nbsp;studies that exploit natural experiments, large and sudden movements of people that have the best hope of&nbsp;making&nbsp;major side-effects of immigration obvious. It was David Card who inaugurated this literature&nbsp;with his 1990 paper on&nbsp;the Mariel boatlift. I tersely summarized that paper&nbsp;this way in a <a href=""http://davidroodman.com/blog/2014/09/03/the-domestic-economic-impacts-of-immigration#Tab2"">table at the end of my review</a>:</p>

<blockquote>Natural experiment not as perfect as randomized since other events could have offset Boatlift&rsquo;s effects. But zero change after 7% labor supply spike most easily explained as (non-)impact.</blockquote>

<p>(Earlier on, my review also discusses the paper more fully.)</p>

<p>The great boatlift began in April 1980 when Fidel Castro opened the Cuban port of Mariel for exit. Americans, presumably including many Cuban-Americans, provided the boats. Wikipedia<a href=""https://en.wikipedia.org/wiki/Mariel_boatlift"">&nbsp;helpfully reviews</a>&nbsp;the local&nbsp;and global&nbsp;events leading to this unusual episode. The major pulse of people came in May and June, and the flow was halted&nbsp;in September. Some 125,000 Cubans came to the US, half settling in Miami (Card, p. 246).</p>

<p>In addition, as Borjas documents, a&nbsp;second wave of Cuban immigration, about half as large, arrived in 1994-95 (Borjas, Figure 1).{footnote_1}</p>

<p>Card&#39;s&nbsp;1990 study analyzes the data two ways, somewhat informally. The first looks at differences over time &ndash; at whether wages, employment, and unemployment rose or fell&nbsp;for various demographic groups in Miami over 1979-85.{footnote_2} The second looks at differences-in-differences. In particular, Card constructs a comparison&nbsp;group of four cities and looks not at whether Miami&#39;s wages, employment, and unemployment rose or fell but at whether they did so more than in the comparison&nbsp;group. This strategy&nbsp;controls for national factors such as economic recession to the extent they affected Miami and the comparison group equally. The comparison&nbsp;cities are Atlanta, Houston, Los Angeles, and Tampa-St. Petersburg. The algorithm for forming&nbsp;the control group was informal:</p>

<blockquote>These four cities&nbsp;were selected both because they had&nbsp;relatively large populations of blacks and&nbsp;Hispanics and because they exhibited a&nbsp;pattern of economic growth similar to that&nbsp;in Miami over the late 1970s and early&nbsp;1980s. (Card, p. 249)</blockquote>

<p>Card generally does not find that things worsened for workers in Miami after 1980, at least not more so than in the comparisons&nbsp;cities. The many specific checks do include exceptions. For example, among blacks&nbsp;in Miami, unemployment jumped from 5.6% to 9.6% between 1980 and 1981, a statistically significant increase, while it held steady at 12.6% in the control group (Card, Table 4, rows 2 &amp; 6). Narrowing to low-education blacks, unemployment did not rise in Miami relative to the control cities until 1982, which Card (p. 253) views as too late for&nbsp;confident attribution to the 1980 boatlift.</p>

<p>My <a href=""http://davidroodman.com/david/Roodman%20Borjas-Card%20replication.zip"">data and code</a> replicate the Card numbers quite well &ndash; some perfectly, the rest&nbsp;close&nbsp;enough to still support Card&#39;s inferences.</p>

<p>Borjas&#39;s retort a quarter century later draws on&nbsp;the same underlying data. But it differs in many respects. It limits the sample to ages 25-59 instead of 16-61, excludes women and Hispanics, favors&nbsp;different cities for the control group, focuses more on&nbsp;low-education workers, and differs in other minor ways.</p>

<p>The study&#39;s conclusion diverges&nbsp;too:</p>

<blockquote>The drop in the relative wage of the least educated Miamians was substantial (10 to 30 percent). (Borjas, p. 1)</blockquote>

<p>And Borjas is laudably transparent: you can <a href=""http://www.hks.harvard.edu/fs/gborjas/publications/journal/JEL2015Archive.zip"">download the Stata code</a> for most of his results from his website. (Underlying data are from <a href=""https://cps.ipums.org/cps-action/variables/group"">IPUMS CPS</a>&nbsp;and <a href=""http://www.nber.org/cps/"">NBER</a>. My own <a href=""http://davidroodman.com/david/Roodman%20Borjas-Card%20replication.zip"">data and code package</a>&nbsp;also contains files&nbsp;needed to reproduce much&nbsp;of the Borjas analysis.)</p>

<p>At first, I found the Borjas conclusion quite striking: in this extreme case of immigrant influx, it seemed that vulnerable people &ndash; those with little education &ndash; actually had suffered, and that this had been overlooked in Card&#39;s analysis. But as I probed more, I became less convinced.</p>

<p>To explain my thinking, I&#39;ll touch on&nbsp;some key differences between the two studies, then show you some graphs of annual&nbsp;data.</p>

<h2>Two data sources</h2>

<p>To my knowledge, the US Census Bureau conducts two surveys that gather national information on people&#39;s work and earnings. Both are part of the Current Population Survey (CPS) family, which originated in efforts during the Great Depression to get a firmer fix on how many people were employed and how much they were making.</p>

<p>According to this <a href=""http://www.nber.org/data/morg.html"">FAQ page</a>, the CPS interviews 50-60,000 households&nbsp;every month. Once a household enters the survey sample, it is interviewed once a month for four months, then left alone for eight months, then interviewed again, in the same four calendar months as before. The last of each quartet of interviews includes questions about how much household members&nbsp;worked and earned in the previous&nbsp;week. Since this information comes from people on their way out of a survey cycle, it is referred to as &quot;Outgoing Rotation Group&quot; data.&nbsp;ORG&nbsp;data undergird&nbsp;the government&#39;s monthly announcements of job growth and unemployment rates.</p>

<p>The other&nbsp;survey is the <a href=""https://www.census.gov/did/www/saipe/data/model/info/cpsasec.html"">Annual&nbsp;Social and Economic Supplement</a>, which is folded into the CPS each March and asks people how much they earned&nbsp;<em>last year</em>. At least in Miami during the years of greatest interest here, this survey&nbsp;reached about half as many people.</p>

<p>Where Card uses ORG data, Borjas works with both data sets, in parallel. Borjas also narrows his sample more than Card, as noted above. This table counts <strong>Miamians in the two Census Bureau data sets in the&nbsp;core Borjas analysis and the most comparable Card analysis</strong>:</p>

<p>{image_1}</p>

<p>Because of the larger&nbsp;samples, analysis based on&nbsp;the ORG data seems more reliable. In addition, the ORG survey records recollections of earnings last week rather than last year, which may be more accurate; on the other hand, weekly data&nbsp;can&nbsp;be noisier since some people&#39;s earnings vary substantially week-to-week. Notably, the&nbsp;more dramatic results in the Borjas paper come from the smaller ASEC samples.</p>

<h2>Whether to include women</h2>

<p>Card includes women in his analysis. Borjas does not. Among the many differences between the two, this one matters. Borjas explains his focus this way:</p>

<blockquote>It is tempting to increase sample size by including working women, but female labor force participation was increasing very rapidly in the 1980s, so that wage trends are likely to be affected by the selection that obviously marks women&rsquo;s entry into the labor market.</blockquote>

<p>I am not sure what this means. The idea seems to be that forces unrelated to the&nbsp;Cuban influx&nbsp;were driving trends in women&#39;s earnings, and these could mask the effect of that influx. [<em>Update, October 21: an email from Borjas appears to confirm this reading.</em>] But similar things might be said for low-education men, whose earnings&nbsp;would&nbsp;have been influenced by broad events&nbsp;such as recessions and de-industrialization. Analytical&nbsp;devices&nbsp;such benchmarking against control groups and focussing on&nbsp;changes&nbsp;<em>immediately&nbsp;</em>after the immigration influx should seemingly work as well for women as for men.</p>

<p>If Borjas excludes women precisely because he knows in advance that their wage trend contradicts&nbsp;the pattern he is looking for, who is engaging in biased selection?</p>

<p>So it seems to me that Borjas&#39;s methods will work as well or poorly for both genders, and that both merit attention.</p>

<h2>Sudden or gradual changes?</h2>

<p>A third differences is that while Card reports annual figures, Borjas groups data into longer periods, in various ways. His graphs show three-year moving averages. Some regressions (Borjas, Tables 5 &amp; 6) compare 1977-79 to 1981-83 and subsequent three-year periods. Others combine 1981-86 into a single &quot;short-run&quot; post-boatlift period.</p>

<p>Combining multiple years of data makes it hard to discern if wages for low-education people dropped suddenly right after&nbsp;the boatlift, or not until a couple of years later, or merely continued a gradual decline.</p>

<p>Put otherwise, Borjas appears readier than Card&nbsp;(or me)&nbsp;to attribute changes 3-5 years after the boatlift to the boatlift. I am unready&nbsp;because many forces buffeted the Miami economy circa 1980 &ndash; an oil shock, extreme interest rates, two recessions, and a debt crisis in Latin America. To be fair, they affected cities in the control group too, but perhaps not equally. A relative wage drop 3-5 years after the boatlift seems to admit many explanations.</p>

<h2>Fresh&nbsp;plots</h2>

<p>To pierce the confusion, I made some graphs. They are designed to closely parallel Borjas&#39;s statistical analysis &ndash; the&nbsp;samples, the control group, the control variables, the&nbsp;formulas for&nbsp;variables such as earnings &ndash; while breaking out the data by year.</p>

<p>The first one plots&nbsp;the evolution of&nbsp;inflation-adjusted earnings for the group in the crosshairs of&nbsp;Borjas&#39;s microscope: low-education, non-Hispanic,&nbsp;male Miami workers aged 25-59. The data come from the ASEC survey, which, recall, yields&nbsp;some&nbsp;20 data points a&nbsp;year circa 1980. (More explanation below the graph. Click or tap it&nbsp;for&nbsp;a larger version.)</p>

<p>{image_2}</p>

<p>In blue are average inflation-adjusted annual earnings for these Miami workers, expressed relative to the levels in the study&#39;s start year,&nbsp;1977.{footnote_3} So a value for some year of 75% means a 25% fall since the start. The smeared blue diamonds depict the 95% confidence ranges&nbsp;for&nbsp;these averages; this novel rendition&nbsp;is meant to remind you that probability is not spread&nbsp;uniformly within those ranges, but concentrated near their centers. (David Sparks <a href=""https://dsparks.wordpress.com/2011/02/21/choropleth-tutorial-and-regression-coefficient-plots"">invented</a>&nbsp;this rendition.&nbsp;<a href=""http://www.soz.unibe.ch/content/ueber_uns/jann/index_ger.html"">Ben Jann</a>&nbsp;brings it to life with his awesome <a href=""https://ideas.repec.org/c/boc/bocode/s457686.html"">coefplot</a>.)</p>

<p>The graph makes it look likely&nbsp;that earnings in&nbsp;this demographic fell between the late 1970s and the early 1980s.</p>

<p>In red, in the same graph, are average wages after adjusting&nbsp;for the evolving the age composition of the group&nbsp;and&nbsp;systematic differences in earnings growth or decline across cities, as well as&nbsp;benchmarking against a Borjas-favored&nbsp;comparison&nbsp;group (Anaheim, Rochester, Nassau-&shy;Suffolk, and San Jose).{footnote_4} All&nbsp;of these adjustments mimic the Borjas analysis. The&nbsp;cities in the Borjas comparison group look peculiar as a collective benchmark for Miami, but were chosen because they most nearly matched Miami&#39;s 1977-80 employment growth rate of 15.3% (Borjas, Table 3).</p>

<p>At any rate, these adjustments make little difference. The red diamonds &ndash; shifted right&nbsp;of the blue ones for legibility &ndash; also&nbsp;show a wage decline from the late 1970s to the early 1980s, with an especially big drop in 1982.</p>

<p>Last, the green diamonds&nbsp;show the result of grouping data into three year-periods, again in order to copy&nbsp;Borjas (Borjas, Table 5 &amp; 6). Comparing green dots, wages were clearly lower in 1981-83 than in 1977-79.</p>

<p>Borjas too makes graphs from ASEC&nbsp;data; they show&nbsp;earnings&nbsp;for low-education men in Miami <a href=""https://web.archive.org/web/20151007165844/http://www.hks.harvard.edu/fs/gborjas/publications/working%20papers/Mariel2015.pdf#page=44"">nosediving in the&nbsp;1980s</a>. I see two problems with those graphs. First, as I mentioned, they plot&nbsp;three-year moving averages, which obscure the timing of the declines in a context where timing is of the essence. Second, unlike the graph&nbsp;above, Brojas&#39;s graphs&nbsp;include no confidence intervals, so they convey false certainty to the untrained eye.</p>

<p>My next graph switches to the more plentiful ORG data set and exploits its coverage to carry forward to 2001, the last year in the Borjas computer code.{footnote_5} A second vertical line is added for the 1994-95 migration surge:</p>

<p>{image_3}</p>

<p>The decline circa 1980 is still visible. But it looks a bit&nbsp;milder now. The trough in 1983 no longer approaches the&nbsp;50%-drop line.&nbsp;And this flattening parallels Borjas&#39;s statistical results, which are milder for ORG data (Borjas, Table 5, row 1, vs. Table 6, row 1).</p>

<p>Nevertheless, Borjas&#39;s finding of a wage decline after the 1980 boatlift still looks&nbsp;reasonable, if read literally.</p>

<p>But I find it hard, viewing these graphs, to confidently attribute that fall to some&nbsp;shock in 1980.&nbsp;The decline appears gradual and long-term. Neither graph displays&nbsp;a sharp, statistically significant drop&nbsp;immediately after the boatlift.</p>

<p>And switching to women reveals an&nbsp;opposite pattern. Their earnings <em>rose</em> after immigration surges:&nbsp;</p>

<p>{image_4}</p>

<p>(In contrast, the <a href=""http://blog.givewell.org/wp-content/uploads/2015/10/learnwkeRealTCMeanASEC12.png"">corresponding graph</a>&nbsp;with&nbsp;ASEC data still shows a&nbsp;slight, statistically insignificant&nbsp;drop among&nbsp;women in 1981.)</p>

<p>Not surprisingly, combining the falling men and rising women smooths things out:</p>

<p>{image_5}</p>

<p>(And here&#39;s the <a href=""http://blog.givewell.org/wp-content/uploads/2015/10/learnwkeRealTCMeanASEC31.png"">corresponding graph</a> from ASEC data.)</p>

<p>Notice that in 1977-82, the blue diamonds for average&nbsp;wages are statistically indistinguishable, as are the red ones for the adjusted means. It is only in 1983 that a larger drop&nbsp;emerges, and even it is transient, indistinguishable from noise. Meanwhile, wages rise, if anything, after the 1994-95 immigration surge.</p>

<p>I believe&nbsp;these graphs provide a clearer picture than the Borjas paper of the underlying data.&nbsp;They do not make a compelling case for harmful side effects of immigration.</p>

<p>Code and data replicating Borjas, Card, and my own analysis are&nbsp;<a href=""http://davidroodman.com/david/Roodman%20Borjas-Card%20replication.zip"">here</a>. Also&nbsp;included is a&nbsp;larger set of graphs generated by that code, covering hourly wages, employment, and unemployment.</p>

<p>All this graphical analysis is a bit loose, but the graphs come from formal&nbsp;regressions, numerical results from which are in <a href=""http://davidroodman.com/david/Borjas%20replication%20tables.pdf"">two tables</a>. These check whether annual and hourly wages and, in the ORG data, employment and unemployment changed significantly in Miami from 1980 to 1981, 1982, or 1983, as well as from 1977-79 to 1981-83. They show changes with little significance by 1981 but more significance by 1982.</p>

<p>Possibly the Mariel boatlift did swamp the Miami labor market, but with a two year delay. But these results are also consistent with the continuation of long-term trends in Miami. I see no strong basis for implicating immigration.</p>

<p>Perhaps I interpret the data differently because of a difference in priors. If I&nbsp;<em>assume</em> that immigration is a potentially leading&nbsp;force in labor markets, then I may be ready to blame the 1980 boatlift for the exceptional wage drop&nbsp;in Miami in&nbsp;the late 1980s, depicted above. But that comes close to assuming the conclusion. If I instead come to the data with more skepticism, mindful that many idiosyncratic forces impinge&nbsp;upon local labor markets, then graphs like that will not change my mind. Only a sharp drop soon after the boatlift would force me to reconsider.</p>

<p>In its favor, Borjas&#39;s work&nbsp;has accentuated my&nbsp;appreciation of the limitations of Card&#39;s study. Even when looking short-term, over a year or so after a major immigration flow, many factors many disturb labor markets enough to obscure the effects of immigration. There is a lot of noise in the data. The appearance of no real effect is not conclusive.</p>

<p>But&nbsp;my previous, terse summary still reads about right to me: &quot;Natural experiment not as perfect as randomized since other events could have offset Boatlift&rsquo;s effects. But zero change after 7% labor supply spike most easily explained as (non-)impact.&quot; More broadly, the overall impact of immigration on workers in the receiving country looks modestly negative at worst, with the most vulnerable group being <em>recent</em> immigrants. And there is little doubt that migrants from poor countries as a group <a href=""https://web.archive.org/web/20150826064431/http://www.cgdev.org/files/1425376_file_Clemens_Economics_and_Emigration_FINAL.pdf"">gain immensely</a> by migrating.</p>
","<p>Thus,&nbsp;as Borjas&nbsp;points out, &quot;<a href=""https://web.archive.org/web/20151007200927/http://personal.psc.isr.umich.edu/yuxie-web/files/soc543-2004/Angrist-Krueger1999.pdf#page=53"">The Mariel Boatlift That Did Not Happen</a>&quot; actually did happen. For clarification of that cryptic statement, see <a href=""http://davidroodman.com/blog/2014/09/03/the-domestic-economic-impacts-of-immigration"">my discussion of Card (1990)</a>.</p>
|<p>Unemployment&nbsp;is the fraction of those in the labor force &ndash; defined as those who have or want work &ndash; who are not&nbsp;working. Employment is the fraction of working-age adults who are working.</p>
|<p>Results come from a regression of log inflation-adjusted annual earnings, expressed per week worked, on year dummies. Results are exponentiated for presentation, producing geometric averages. Copying&nbsp;Borjas, the sample is male, non-hispanic workers aged 25-59; &quot;top-coded&quot; earnings are multiplied by 1.5; those with hourly wages below $1.50 or above $40 in 1980 dollars are excluded;&nbsp;Census Bureau-supplied weights are incorporated; and standard errors are heteroskedasticity-robust.</p>
|<p>Regressions are the same as before, but now including dummies for years, the four control cities, and 5-year age groups.</p>
|<p>The dependent variable is the log of last week&#39;s earnings. Following Borjas, the sample is male, non-hispanic workers aged 25--59; &quot;top-coded&quot; earnings are multiplied by 1.5; and those with hourly wages below $1.50 or above $40 in 1980 dollars are excluded.</p>
","27/10/2015 07:28:00"
