"entry_id","post_title","post_content","footnotes","post_date"
"1170","GiveWell’s Top Charities Are (Increasingly) Hard to Beat","<p><em>In this post, &ldquo;we&rdquo; refers to Good Ventures and the <a href=""https://www.openphilanthropy.org/about/who-we-are"">Open Philanthropy Project,</a> who work as partners.</em></p>

<p>Our <a href=""https://www.openphilanthropy.org/blog/update-cause-prioritization-open-philanthropy"">thinking on prioritizing across different causes</a> has evolved as we&rsquo;ve made more grants. This post explores one aspect of that: the high bar set by the best global health and development interventions, and what we&rsquo;re learning about the relative performance of some of our other grantmaking areas that seek to help people today. To summarize:</p>

<ul>
	<li>When we were getting started, we used unconditional cash transfers to people living in extreme poverty (a program run by <a href=""https://www.givedirectly.org"">GiveDirectly</a>) as &ldquo;the bar&rdquo; for being willing to make a grant, on the grounds that such giving was quite cost-effective and likely extremely scalable and persistently available, so we should not generally make grants that we expected to achieve less benefit per dollar than that. Based on the roughly 100-to-1 ratio of average consumption between the average American and GiveDirectly cash transfer recipients, and a logarithmic model of the utility of money, we call this the &ldquo;100x bar.&rdquo; So if we are giving to, e.g., encourage policies that increase incomes for average Americans, we need to increase them by $100 for every $1 we spend to get as much benefit as just giving that $1 directly to GiveDirectly recipients. <a href=""#extremepoverty"">More</a>.</li>
	<li>GiveWell (<a href=""https://www.openphilanthropy.org/about/who-we-are"">which we used to be part of and remain closely affiliated with</a>) has continued to find more and larger opportunities over time, and <a href=""https://blog.givewell.org/2019/02/07/how-givewells-research-is-evolving/"">become more optimistic about finding more cost-effective ones in the future</a>. This has the implication that we should raise &ldquo;the bar&rdquo; to something closer to the current estimated cost-effectiveness of GiveWell&rsquo;s unfunded top charities, which they believe to be in the range of 5-15x more cost-effective than 100x cash transfers, meaning a bar of benefits 500-1,500 times the cost of our grants (which we approximate to a &ldquo;1,000x bar&rdquo;). <a href=""#bestprograms"">More.</a></li>
	<li>Since adopting cash transfers as the relevant benchmark for our giving aimed at <a href=""https://www.openphilanthropy.org/blog/update-cause-prioritization-open-philanthropy"">helping people alive today</a>, we&rsquo;ve given ~$100M in U.S. policy, ~$100M in scientific research, and ~$300M based on GiveWell recommendations. According to our extremely rough internal calculations, we do expect many of our grants in scientific research and U.S. policy to exceed the &ldquo;100x bar&rdquo; represented by unconditional cash transfers, but relatively few to clear a &ldquo;1,000x bar&rdquo; roughly corresponding to high-end estimates for GiveWell&rsquo;s unfunded top charities. This would imply that it&rsquo;s quite difficult/rare for work in these categories to look more cost-effective than GiveWell&rsquo;s top charities. However, these calculations are extraordinarily rough and uncertain. <a href=""#peopletoday"">More.</a></li>
	<li>In spite of these calculations, we think there are some good arguments to consider in favor of our current grantmaking in these areas. <a href=""#counterconsiderations"">More</a>.</li>
	<li>We continue to think it is likely that there are causes aimed at helping people today (potentially including our current ones) that could be more cost-effective than GiveWell&rsquo;s top charities, and we are <a href=""https://hire.withgoogle.com/public/jobs/openphilanthropyorg/view/P_AAAAAAFAACuGJXzLj5l5Sp?trackingTag=openPhilanthropyWebsite"">hiring researchers</a> to work on finding and evaluating them. <a href=""#shouldbe"">More</a>.</li>
	<li>We are still thinking through the balance of these considerations. We are not planning any rapid changes in direction. <a href=""#conclusion"">More</a>.</li>
</ul>

<h2><a id=""extremepoverty"" name=""extremepoverty""></a>Cash transfers to people in extreme poverty</h2>

<p>In 2015, when we were still part of GiveWell, <a href=""https://blog.givewell.org/2015/11/25/good-ventures-and-giving-now-vs-later/#Benchmark"">we wrote</a>:</p>

<blockquote>By default, we feel that any given grant of $X should look significantly better than <strong>making direct cash transfers (totaling $X) to people who are extremely low-income by global standards</strong> &ndash; abbreviated as &ldquo;direct cash transfers.&rdquo; We believe it will be possible to give away very large amounts, at any point in the next couple of decades, via direct cash transfers, so any grant that doesn&rsquo;t meet this bar seems unlikely to be worth making&hellip;.<br />
<br />
It&rsquo;s possible that this standard is too lax, since we might find plenty of giving opportunities in the future that are much stronger than direct cash transfers. However, at this early stage, it isn&rsquo;t obvious how we will find several billion dollars&rsquo; worth of such opportunities, and so &ndash; as long as total giving remains within the ... budget &ndash; we prefer to err on the side of recommending grants when we&rsquo;ve completed an investigation and when they look substantially better than direct cash transfers.<br />
<br />
It is, of course, often extremely unclear how to compare the good accomplished by a given grant to the good accomplished by direct cash transfers. Sometimes we will be able to do a rough quantitative estimate to determine whether a given grant looks much better, much worse or within the margin of error. (In the case of our top charities, <a href=""https://blog.givewell.org/2015/11/18/our-updated-top-charities-for-giving-season-2015/"">we think that donations to AMF, SCI and Deworm the World look substantially better.</a>) Other times we may have little to go on for making the comparison other than intuition. Still, thinking about the comparison can be informative. For example, when considering grants that will primarily benefit people in the U.S. (such as supporting work on criminal justice reform), benchmarking to direct cash transfers can be a fairly high standard. Based on the idea that the value of additional money is roughly proportional to the logarithm of income, {footnote_1} and the fact that mean American income is around 100x annual consumption for GiveDirectly recipients, we assume that a given dollar is worth ~100x as much to a GiveDirectly recipient as to the average American. Thus, in considering grants that primarily benefit Americans, we look for a better than &ldquo;100x return&rdquo; in financial terms (e.g. increased income). Of course, there are always huge amounts of uncertainty in these comparisons, and we try not to take them too literally.</blockquote>

<p>To walk through the logic of how this generates a &ldquo;100x&rdquo; bar a bit more clearly:</p>

<ul>
	<li>We want to be able to compare philanthropic opportunities that will save the U.S. or state governments money, or increase incomes for average Americans, against opportunities to directly help the global poor (or deliver other benefits) in a somewhat consistent fashion. For instance, we could imagine a hypothetical domestic advocacy opportunity that might be able to save the government $100 million, or increase productivity by $100 million, for a cost of $1 million; we would call that opportunity roughly &ldquo;100x&rdquo; because the benefit in terms of income to the average American is $100 for every $1 we spend.{footnote_2} If we just directly gave a random person in the U.S. $1,000, we&rsquo;d expect to get &ldquo;1x&rdquo; because the benefit to them is equal to the cost to us (ignoring transaction costs). That is, we take our core unit of measurement for this exercise as &ldquo;dollars to the average American.&rdquo; Then we face the question: how should we compare transfers to the global poor (or other programs) to transfers to the average American?</li>
	<li>GiveWell reports that the income of GiveDirectly recipients averages $0.79 per day{footnote_3} &mdash; so approximately $290 per person per year, compared to more than $34,000 per capita per year in the U.S.{footnote_4} This means $34,000 could double one individual&rsquo;s income for a year in the U.S., or (after ~10% overhead is taken out) double the income of about 106 GiveDirectly recipients for a year.{footnote_5}</li>
	<li>In this context we assume a logarithmic utility function for income, which is a fairly common simplification and assumes that doubling a person&rsquo;s income contributes the same amount to their well-being regardless of how much income they started with. We think this is a plausible starting point based on evidence from life satisfaction surveys.{footnote_6} However, it is worth noting that there are credible arguments that a logarithmic utility function places either too much or too little weight on income at the high end.{footnote_7}<fn> </fn></li>
	<li>A logarithmic utility function implies that $1 for someone with 100x less income/consumption is worth 100x as much. This implies direct cash transfers to the extreme global poor go about 100x as far as the same money spent in the U.S., on average, and means any potential grant should create an expected value at least 100x the cost of the grant if it is to be considered a better use of money than such direct cash transfers.</li>
	<li>With other causes, in addition to looking at monetary savings or gains, we also use &ldquo;value of a statistical life&rdquo; techniques to try to account for health and quality-of-life benefits. That yields more cost-effectiveness estimates, all generally framed in the language of &ldquo;This seems roughly as good as saving an average American $N for each $1 we spend&rdquo; or simply &ldquo;Nx.&rdquo;</li>
</ul>

<p>Obviously, calculations like this remain deeply uncertain and vulnerable to large mistakes, so we try to not put too much weight on them in any one case. But the general reality that they reflect&nbsp;&mdash; of vast global inequalities, and the relative ease of moving money from people who have a lot of it to people who have little&nbsp;&ndash; seems <a href=""https://blog.givewell.org/2013/06/11/the-moral-case-for-giving-doesnt-rely-on-questionable-quantitative-estimates/"">quite robust</a>.</p>

<p>Although we stopped formally using this 100x benchmark across all of our giving <a href=""https://www.openphilanthropy.org/blog/update-cause-prioritization-open-philanthropy#No_more_unified_benchmark"">a couple of years ago</a> because of considerations relating to animals and future generations, we have continued to find it a useful benchmark against which &ldquo;<a href=""https://www.openphilanthropy.org/blog/update-cause-prioritization-open-philanthropy"">near-termist, human-centric</a>&rdquo; grants &ndash; those that aim to improve the lives of humans on a relatively short time horizon, including a mix of direct aid, policy work, and scientific research&nbsp;&ndash; can be measured.</p>

<h2><a id=""bestprograms"" name=""bestprograms""></a>The best programs are even harder to beat</h2>

<p>In 2015, when we <a href=""https://blog.givewell.org/2015/11/25/good-ventures-and-giving-now-vs-later/#Benchmark"">first wrote about adopting the cash transfer benchmark</a>, it looked like GiveWell could plausibly &ldquo;run out&rdquo; of their more-cost-effective-than-cash giving opportunities. <a href=""https://blog.givewell.org/2015/11/18/our-updated-top-charities-for-giving-season-2015/"">At the time</a>, they had three non-cash-transfer top charities they estimated to be in the 5-10x cash range (i.e., 5 to 10 times more cost-effective than cash transfers),{footnote_8} with ~$145 million of estimated short-term room for more funding. That, plus uncertainty about the amount of weight to put on these figures, led us to adopt the cash transfer benchmark. (In the remainder of this post, I occasionally shorten &ldquo;cash transfer&rdquo; to just &ldquo;cash.&rdquo;) But by <a href=""https://blog.givewell.org/2018/11/26/our-updated-top-charities-for-giving-season-2018/"">the end of 2018</a>, GiveWell had expanded to seven non-cash-transfer top charities estimated to be in the ~5-15x cash range, with $290 million of estimated short-term room for more funding, and with the top recommended unfilled gaps at ~8x cash transfers.{footnote_9} If we combine cash transfers at &ldquo;100x&rdquo; and large unfilled opportunities at ~5-15x cash transfers, the relevant &ldquo;bar to beat&rdquo; going forward may be more like 500-1,500x.{footnote_10} And <a href=""https://blog.givewell.org/2019/02/07/how-givewells-research-is-evolving/"">earlier this year</a> GiveWell suggested that they expected to find more cost-effective opportunities in the future, and they <a href=""https://blog.givewell.org/2019/02/07/how-givewells-research-is-evolving/"">are staffing up in order to do so</a>.</p>

<p>Another approach to this question is to ask, how much better than direct cash transfers should we expect the best underfunded interventions to be? I find scalable interventions worth ~5-15x cash <a href=""https://blog.givewell.org/2012/05/30/giving-cash-versus-giving-bednets/"">a bit surprising</a>, but not wildly so. It&rsquo;s not obvious where to look for a <a href=""https://en.wikipedia.org/wiki/Prior_probability"">prior</a> on this point, and it seems to correlate strongly with general views about <a href=""https://blog.givewell.org/2013/05/02/broad-market-efficiency/"">broad market efficiency</a>: if you think broad &ldquo;markets for doing good&rdquo; are efficient, finding a scalable ~5-15x baseline intervention might be especially surprising; conversely if you think markets for doing good are riddled with inefficiencies, you might expect to find many even more cost-effective opportunities.</p>

<p>One place to potentially look for priors on this point might be compilations of the cost-effectiveness of various evidence-based interventions. I know of five compilations of the cost-effectiveness of different interventions within a given domain that contain easily available tabulations of the interventions reviewed:{footnote_11}</p>

<ul>
	<li>The <a href=""https://www.wsipp.wa.gov/BenefitCost"">Washington State Institute for Public Policy benefit-costs results database</a> (<a href=""https://web.archive.org/web/20190702022554/https://www.wsipp.wa.gov/BenefitCost"">archive</a>), focused on U.S. social policies.</li>
	<li><a href=""https://academic.oup.com/jpubhealth/article/34/1/37/1554654"">Two</a> <a href=""https://academic.oup.com/jpubhealth/article/40/3/557/4160397"">reviews</a> of public health interventions considered by the UK&rsquo;s National Institute for Health and Care Excellence (NICE).</li>
	<li><a href=""http://dcp-3.org/dcp2"">The Disease Control Priorities report 2nd Edition</a> (<a href=""https://web.archive.org/web/20190702022641/http://dcp-3.org/dcp2"">archive</a>), focused on global health interventions.</li>
	<li><a href=""http://dcp-3.org/sites/default/files/chapters/Annex%207A.%20Details%20of%20Interventions%20in%20Figs.pdf"">The Disease Control Priorities report 3rd Edition</a> (<a href=""https://web.archive.org/web/20190702022740/http://dcp-3.org/sites/default/files/chapters/Annex%207A.%20Details%20of%20Interventions%20in%20Figs.pdf"">archive</a>), focused on global health interventions.</li>
	<li><a href=""https://www.who.int/choice/results/afre/en/"">WHO Choice results</a> (<a href=""https://web.archive.org/web/20190702022810/https://www.who.int/choice/results/afre/en/"">archive</a>) for the <a href=""https://www.who.int/quantifying_ehimpacts/global/ebdcountgroup/en/"">AFR E region</a> (<a href=""https://web.archive.org/web/20190702022910/https://www.who.int/quantifying_ehimpacts/global/ebdcountgroup/en/"">archive</a>), focused on global health interventions.</li>
</ul>

<p>For this purpose, I was just curious about the general distribution of the estimates, and didn&rsquo;t attempt to verify any of them, and was very rough in discarding estimates that were negative or didn&rsquo;t have numerical answers, which may bias my conclusions. In general, we regard the calculations included in these compilations as challenging and error-prone, and we would caution against over-reliance on them{footnote_12}.</p>

<p>I made a sheet summarizing the sources&rsquo; estimates <a href=""https://docs.google.com/spreadsheets/d/16Jy1SbeozJnIP6GY6VyQybXINC7orrBe4wBW-uVrIQ4/edit#gid=1413138877"">here</a>. All five distributions appear to be (very roughly) <a href=""https://en.wikipedia.org/wiki/Log-normal_distribution"">log-normal</a>, with standard deviations of ~0.7-1, implying that a one-standard-deviation increase in cost-effectiveness would equate to a 5-10x improvement. However, any errors in these calculations would typically inflate that figure, and we think they are structurally highly error-prone, so these standard deviations likely substantially overstate the true ones.{footnote_13}</p>

<p>We don&rsquo;t know what the mean of the true distribution of cost-effectiveness of global development opportunities might be, but assuming it&rsquo;s not more than a few times different from cash transfers (in either direction), and that measurement error doesn&rsquo;t make up more than half of the variance in the cost-effectiveness compilations reviewed above (a non-trivial assumption), then these figures imply <strong>we shouldn&rsquo;t be too surprised to see top opportunities ~5-15x cash</strong>. A <a href=""http://www.normaltable.com/"">normal distribution</a> would imply that an opportunity two standard deviations above the mean is in the ~98th percentile. These figures would support more skepticism towards an opportunity from the same rough distribution (evidence-based global health interventions) that is claimed to be even more cost-effective (e.g., 100x or 1,000x cash rather than 10x).</p>

<p>Stepping back from the modeling, given the vast difference in treatment costs per person for different interventions (<a href=""https://www.givewell.org/charities/amf#CostperLLINdistributed"">~$5 for bednets</a>, <a href=""https://www.givewell.org/charities/Schistosomiasis-Control-Initiative#Our_analysis"">$0.33-~$1 for deworming</a>, <a href=""https://www.givewell.org/charities/give-directly"">~$250 for cash transfers</a>), it does seem plausible to have large (~10x) differences in cost-effectiveness.</p>

<p>Even if scalable global health interventions were much worse than we currently think, and, say, only ~3x as cost-effective as cash transfers, I expect <a href=""https://blog.givewell.org/2019/02/07/how-givewells-research-is-evolving/"">GiveWell&rsquo;s foray into more leveraged interventions</a> to yield substantial opportunities that are at least several times more cost-effective, pushing back towards ~10x cash transfers as a more relevant future benchmark for unfunded opportunities.</p>

<p>Overall, given that GiveWell&rsquo;s numbers imply something more like &ldquo;1,000x&rdquo; than &ldquo;100x&rdquo; for their current unfunded opportunities, that those numbers seem plausible (though by no means ironclad), and that they may find yet-more-cost-effective opportunities in the future, it looks like the relevant &ldquo;bar to beat&rdquo; going forward may be more like 1,000x than 100x.</p>

<h2><a id=""peopletoday"" name=""peopletoday""></a>Our other grantmaking aimed at helping people today</h2>

<p>While we think a lot of our &ldquo;<a href=""https://www.openphilanthropy.org/blog/update-cause-prioritization-open-philanthropy"">near-termist, human-centric</a>&rdquo; grantmaking clears the 100x bar, we see less evidence that it will clear a ~1,000x bar.</p>

<p>Since we initially adopted the cash transfer benchmark in 2015, we&rsquo;ve made roughly 300 grants totalling almost $200 million in our <a href=""https://www.openphilanthropy.org/blog/update-cause-prioritization-open-philanthropy"">near-termist, human-centric</a> focus areas of <a href=""https://www.openphilanthropy.org/focus/us-policy/criminal-justice-reform"">criminal justice reform</a>, <a href=""https://www.openphilanthropy.org/focus/us-policy/immigration-policy"">immigration policy</a>, <a href=""https://www.openphilanthropy.org/focus/us-policy/land-use-reform"">land use reform</a>, <a href=""https://www.openphilanthropy.org/focus/us-policy/macroeconomic-policy"">macroeconomic stabilization policy</a>, and <a href=""https://www.openphilanthropy.org/focus/scientific-research-archive"">scientific research</a>. To get a sense of our estimated returns for these grants, we looked at the largest grants and found 33 grants totalling $73M for which the grant investigator conducted an <em>ex ante</em> &ldquo;back-of-the-envelope-calculation&rdquo; (&ldquo;BOTEC&rdquo;) to roughly estimate the expected cost-effectiveness of the potential grant for Open Philanthropy decision-makers&rsquo; consideration.</p>

<p>All of these 33 grants were estimated by their investigator to have an expected cost-effectiveness of at least 100x. This makes sense given the existence of our &ldquo;100x bar.&rdquo; Of those 33, only eight grants, representing approximately $32 million, had BOTECs of 1,000x or greater. Our <a href=""http://www.goodventures.org/our-portfolio/grants/target-malaria-general-support"">large grant to Target Malaria</a> accounts for more than half of that.</p>

<p>Although we don&rsquo;t typically make our internal BOTECs public, we compiled a set <a href=""https://docs.google.com/document/d/1GsE2_TNWn0x6MWL1PTdkZT2vQNFW8VFBslC5qjk4sgo/edit?ts=5cc10604"">here</a> (redacted somewhat to protect some grantees&rsquo; confidentiality) to give a flavor of what they look like. As you can see, they are exceedingly rough, and take at face value many controversial and uncertain claims (e.g., the cost of a prison-year, the benefit of a new housing unit in a supply-constrained area, the impact of monetary policy on wages, the likely impacts of various other policy changes, stated probabilities of our grantees&rsquo; work causing a policy change). We would guess that these uncertainties would generally lead our BOTECs to be over-optimistic (rather than merely adding unbiased noise) for a variety of reasons:</p>

<ul>
	<li>Program officers do the calculations themselves, and generally only do the calculations for grants they&rsquo;re already inclined to recommend. Even if there&rsquo;s zero cynicism or intentional manipulation to get &ldquo;above the bar,&rdquo; grantmakers (including me) seem likely to be more charitable to their grants than others would be.</li>
	<li>Many of these estimates don&rsquo;t adjust for relatively straightforward considerations that would systematically push towards lower estimated cost-effectiveness, like declining marginal returns to funding at the grantee level, time discounting, or potential non-replicability of the research our policy goals are based on. The comparison with the level of care in <a href=""https://www.givewell.org/how-we-work/our-criteria/cost-effectiveness/cost-effectiveness-models"">the GiveWell cost-effectiveness models</a> on these features is pretty stark.</li>
	<li>Holden made some more general arguments along these lines <a href=""https://blog.givewell.org/2011/08/18/why-we-cant-take-expected-value-estimates-literally-even-when-theyre-unbiased/"">in 2011</a>.</li>
</ul>

<p>We think it&rsquo;s notable that <strong>despite likely being systematically over-optimistic in this way, it&rsquo;s still rare for us to find grant opportunities in U.S. policy and scientific research that appear to score better than GiveWell&rsquo;s top charities</strong>. Of course, compared to GiveWell, we make many more grants, to more diverse activities, and with an <a href=""http://www.goodventures.org/research-and-ideas/blog/projects-people-and-processes"">explicit policy</a> of trying to rely more on program officer judgment than these BOTECs. So the idea that our models look less robust than GiveWell&rsquo;s is not a surprise &mdash; we&rsquo;ve always expected that to be the case &mdash; but combining that with GiveWell&rsquo;s rising bar is a more substantive update.</p>

<h2><a id=""counterconsiderations"" name=""counterconsiderations""></a>Some counter-considerations in favor of our work</h2>

<p>As we&rsquo;re grappling with the considerations above, we don&rsquo;t want to give short shrift to the arguments in favor of our work. We see two broad categories of arguments in this vein: (a) this work may be substantively better than the BOTECs imply; and (b) it&rsquo;s a worthwhile experiment.</p>

<p><em>This work may be better than the BOTECs imply</em></p>

<p>There are a couple big reasons why Open Phil&rsquo;s <a href=""https://www.openphilanthropy.org/blog/update-cause-prioritization-open-philanthropy"">near-termist, human-centric</a> work could turn out to be better than implied by the figures above:</p>

<ul>
	<li><strong>Values/moral weights</strong>. A logarithmic utility function and view that &ldquo;all lives have equal value&rdquo; push strongly towards work focused on the global poor. But many people endorse much flatter utility functions in money and the use of context-specific &ldquo;value of a statistical life&rdquo; figures, both of which would make work in the U.S. generally look much more attractive. And of course many people think we have stronger normative obligations to attend to our neighbors and fellow citizens, which would also make our non-GiveWell near-termist work look more valuable (though we have historically <a href=""https://blog.givewell.org/2013/04/04/deep-value-judgments-and-worldview-characteristics/"">been skeptical of such normative views</a>). (You could make similar arguments on instrumental rather normative grounds too, e.g., by arguing that <a href=""https://blog.givewell.org/2013/05/15/flow-through-effects/"">flow-through effects</a> from work in the U.S. would be larger.) Arguably we should put some weight on ideas like these in our <a href=""https://www.openphilanthropy.org/blog/worldview-diversification#The_case_for_worldview_diversification"">worldview diversification process</a>.</li>
	<li><strong>Hits</strong>. We are explicitly pursuing a <a href=""http://www.goodventures.org/research-and-ideas/blog/hits-based-giving"">hits-based approach to philanthropy</a> with much of this work, and accordingly might expect just one or two &ldquo;hits&rdquo; from our portfolio to carry the whole. In particular, if one or two of our large science grants ended up 10x more cost-effective than GiveWell&rsquo;s top charities, our portfolio to date would cumulatively come out ahead. In fact, the dollar-weighted average of the 33 BOTECs we collected above is (modestly) above the 1,000x bar, reflecting our <em>ex ante</em> assessment of that possibility. But the concerns about the informational value of those BOTECs remain, and most of our grants seems noticeably less likely to deliver such &ldquo;hits.&rdquo;</li>
	<li><strong>Mistaken analysis</strong>. As we&rsquo;ve noted, we consider our BOTECs to be extremely rough. We think it&rsquo;s more likely than not that better-quality BOTECs would make the work discussed above look still weaker, relative to GiveWell top charities - but we are far from certain of this, and it could go either way, especially if our policy reform efforts could contribute meaningfully to &ldquo;tipping points&rdquo; that lead to accelerating policy changes in the future.</li>
</ul>

<p><em>It&rsquo;s a worthwhile experiment</em></p>

<p>Our <a href=""https://www.openphilanthropy.org/blog/update-cause-prioritization-open-philanthropy"">near-termist, human-centric</a> giving since adopting the cash benchmark can be broken into roughly three groups: ~$100M for U.S. policy, ~$100M for scientific research, and ~$300M based on GiveWell recommendations in global health and development. We think given the amount of giving we anticipate doing in the future, an experimental effort of that scale is worth running. As <a href=""https://www.openphilanthropy.org/blog/worldview-diversification#Capacity_building_and_option_value"">we&rsquo;ve discussed before</a>, we see many benefits from giving in multiple different kinds of causes that are not fully captured by the impact of the grants themselves, including:</p>

<ul>
	<li><strong>Learning</strong>. If our only giving were in long-termist and animal-oriented causes and to the GiveWell top charities, we think we&rsquo;d learn a lot less about effective giving writ large and the full suite of tools available to a philanthropist aiming to effect change. We think that would make us less effective overall (though we give limited weight to this consideration).</li>
	<li><strong>Developing a concrete track record</strong>. We see a lot of value for ourselves and others in working in some areas with relatively short feedback loops, where it&rsquo;s easier to observe whether our giving is achieving its intended impact. We would like it to be possible for us and others to recognize whether we are achieving any of our desired impacts, and that looks far more likely in our <a href=""https://www.openphilanthropy.org/blog/update-cause-prioritization-open-philanthropy"">near-termist human-centric</a> causes than in the bulk of the other causes we work on.</li>
	<li><strong>Option value</strong>. Developing staff capacity to work in many (different kinds of) causes provides the ability to adjust if our desired worldview allocation changes over time (which seems quite possible).</li>
	<li><strong>Helping other donors</strong>. Giving in a diverse set of causes increases our long-run odds of having large effects on the general dialogue around philanthropy, since we could provide tangibly useful information to a larger set of donors.</li>
</ul>

<p>We see a number of other practical benefits to working in a broad variety of causes, including presenting an accurate public-facing picture of our values and making our organization a more appealing place to work.</p>

<p>Finally, it is worth noting that while we think GiveWell&rsquo;s cost-effectiveness estimates are (far) more reliable than the very rough BOTECs we have done, we do not think their estimates (or any cost-effectiveness estimates we&rsquo;ve ever seen) can be taken literally, or even used with much confidence.</p>

<h2><a id=""shouldbe"" name=""shouldbe""></a>It should be possible to outperform the GiveWell top charities</h2>

<p>Although this post describes some doubts about how some of our giving to date may compare to the GiveWell top charities, we continue to think it should be possible to achieve more cost-effective results than the current GiveWell top charities via advocacy or scientific research funding rather than direct services. To the extent that there is a single overarching update here &mdash; which we are uncertain about &mdash; we think it is likely to be against the possibility of achieving sufficient leverage via advocacy or scientific research aimed at benefiting people in the U.S. or other wealthy countries <em>alone</em>. We have only explored a small portion of the space of possible causes in this broad area, and continue to expect that advocacy or scientific research, perhaps more squarely aimed at the global poor, could have outsized impacts. Indeed, GiveWell seems to agree this is possible, with their <a href=""https://blog.givewell.org/2019/02/07/how-givewells-research-is-evolving/"">expansion into considering advocacy opportunities</a> within global health and development.</p>

<p>As we look more closely at our returns to date and going forward, we&rsquo;re also interested in exploring other causes that may have especially high returns. One hypothesis we&rsquo;re interested in exploring is the idea of combining multiple sources of leverage for philanthropic impact (e.g., advocacy, scientific research, helping the global poor) to get more humanitarian impact per dollar (for instance via <a href=""https://www.openphilanthropy.org/focus-area/scientific-research/science-policy-and-infrastructure"">advocacy around scientific research funding or policies</a>, or <a href=""https://www.openphilanthropy.org/focus/scientific-research/miscellaneous/target-malaria-general-support"">scientific research around global health interventions</a>, or <a href=""https://www.openphilanthropy.org/focus/global-health-and-development/miscellaneous/center-global-development-general-support-2016"">policy around global health and development</a>). Additionally, on the advocacy side, we&rsquo;re interested in exploring opportunities outside the U.S.; we initially focused on U.S. policy for epistemic rather than moral reasons, and expect most of the most promising opportunities to be elsewhere.</p>

<p>If this sounds interesting, you should consider applying: we&rsquo;re <a href=""https://hire.withgoogle.com/public/jobs/openphilanthropyorg/view/P_AAAAAAFAACuGJXzLj5l5Sp?trackingTag=openPhilanthropyWebsite"">hiring for researchers</a> to help.</p>

<h2><a id=""conclusion"" name=""conclusion""></a>Conclusion</h2>

<p>We are still in the process of thinking through the implications of these claims, and we are not planning any rapid changes to our grantmaking at this time. We currently plan to continue making grants in our current focus areas at approximately the same level as we have for the last few years while we try to come to more confident conclusions about the balance of considerations above. As Holden outlined in a <a href=""http://www.goodventures.org/blog/our-progress-in-2018-and-plans-for-2019/#self-evaluation"">recent blog post</a>, a major priority for the next couple years is building out our impact evaluation function. We expect that will help us develop a more confident read on our impact in our most mature portfolio areas, and accordingly will place us in a better position to approach big programmatic decisions. We will hopefully improve the overall quality of our BOTECs in other ways as well.</p>

<p>If, after building out this impact evaluation function and applying it to our work to date, we decided to substantially reduce or wind down our giving in any of our current focus areas, we&rsquo;d do so gradually and responsibly, with ample warning and at least a year or more of additional funding (as much as we feel is necessary for a responsible transition) to our key partner organizations. We have no current plans to do this, and we know funders communicating openly about this kind of uncertainty is unusual and can be unnerving, but our hope is that sharing our latest thinking will be <a href=""https://www.openphilanthropy.org/blog/update-how-were-thinking-about-openness-and-information-sharing#Our_approach_going_forward"">useful for others</a>.</p>

<p>Finally, we&rsquo;re planning to write more at a later date about the cost-effectiveness of our &ldquo;<a href=""https://www.openphilanthropy.org/blog/update-cause-prioritization-open-philanthropy"">long-termist</a>&rdquo; and animal-inclusive grantmaking and the implications for our future resource allocation.</p>
","<p>See e.g. <a href=""https://www.brookings.edu/research/subjective-well%E2%80%90being-and-income-is-there-any-evidence-of-satiation/"">Subjective Well‐Being and Income: Is There Any Evidence of Satiation?</a> (<a href=""https://web.archive.org/web/20190702021919/https://www.brookings.edu/research/subjective-well%E2%80%90being-and-income-is-there-any-evidence-of-satiation/"">archive</a>)</p>

<blockquote>For instance Deaton (2008) and Stevenson and Wolfers (2008) find that the well-being&ndash;income relationship is roughly a linear-log relationship, such that, while each additional dollar of income yields a greater increment to measured happiness for the poor than for the rich, there is no satiation point.</blockquote>
|<p>We&rsquo;re eliding a huge amount of complexity here in terms of modeling the domestic welfare impacts of various policy changes, which we recognize. In practice, our calculations are often very crude, though we try to be roughly consistent in considering distributional issues and weighing whether incomes are increasing due to productivity changes, prevented waste, or other causes.</p>
|<p>See <a href=""https://www.givewell.org/charities/give-directly#footnote33_26yj8bd"">footnote 33</a> in GiveWell&rsquo;s writeup on GiveDirectly.</p>
|<p>2017 average U.S., per capita income was $34,489, <a href=""https://www.census.gov/data/tables/time-series/demo/income-poverty/historical-income-people.html"">per the U.S. Census</a>. (<a href=""https://web.archive.org/web/20190702022008/https://www.census.gov/data/tables/time-series/demo/income-poverty/historical-income-people.html"">archive</a>)</p>
|<p>$34,000 / ($288.35 / 0.9) = ~106. Using median U.S. income rather than mean would reduce this ~20% but seems less apt as a comparison since we&rsquo;re partially modeling foregone spending and taxes are moderately progressive.</p>
|<p>See <em><a href=""https://www.brookings.edu/wp-content/uploads/2008/03/2008a_bpea_stevenson.pdf"">Economic Growth and Subjective Well-Being: Reassessing the Easterlin Paradox</a></em>. (<a href=""https://web.archive.org/web/20190702022049/https://www.brookings.edu/wp-content/uploads/2008/03/2008a_bpea_stevenson.pdf"">archive</a>)</p>
|<p>Too much: there is <a href=""https://flightfromperfection.com/files/post_attachments/jebb_et_al_2018.pdf"">some evidence of satiation</a> (<a href=""https://web.archive.org/web/20190702022114/https://flightfromperfection.com/files/post_attachments/jebb_et_al_2018.pdf"">archive</a>) in terms of self-reported wellbeing even in log terms as incomes get very high by global standards. Additionally, if you think very high incomes carry net negative externalities (e.g., through carbon emissions or excess political influence), you may even think additional income at the high end should be treated as negative. Finally, placing high moral weight on marginal consumption for high-income people seems to imply that their lives &ldquo;have a lot more value in them&rdquo; or &ldquo;are worth a lot more,&rdquo; which seems problematic.</p>

<p><br />
Too little: people continue to exercise substantial effort to increase their own income, even at high levels, and there seem to be obvious benefits beyond subjective wellbeing that accrue to them from doing so (such as increased lifespan or educational access). Additionally, if you&rsquo;re discounting income or consumption logarithmically or more, even very small positive spillovers from high income people to others (e.g., through employment, charity, or bequests) could swamp the first order effects in a utility calculation.</p>
|<p>This 5-10x cash range translated to roughly ~$2,000-4,000 per &ldquo;life saved equivalent&rdquo; in the 2015 cost-effectiveness calculation - <a href=""https://www.givewell.org/files/DWDA%202009/Interventions/GiveWell_cost-effectiveness_analysis_2015.xlsx"">XLSX</a>.</p>
|<p>Based on <a href=""https://docs.google.com/spreadsheets/d/15pzFH5e4k4qQwOX5ffqQcJNPK4RnVJ-b5EFd9ZUtlJs/edit#gid=1034883018"">the median results from GiveWell&rsquo;s final 2018 cost-effectiveness calculation</a>, 8x cash implies a &ldquo;cost-per outcome as good as saving an under-5 life&rdquo; of ~$1,500. This is not directly comparable to the figures from 2015 because GiveWell made some changes in the values and framework used in their cost-effectiveness calculation, which affect both the outcome measures and the comparisons between them.</p>
|<p>Another way to get similarly high overall ROI figures is from comparing GiveWell&rsquo;s top charity &ldquo;cost per life saved equivalent&rdquo; figures to rich world &ldquo;value of a statistical life&rdquo; figures:</p>

<ul>
	<li>GiveWell estimates that <a href=""https://docs.google.com/spreadsheets/d/1McptF0GVGv-QBlhWx_IoNVstWvt1z-RwVSu16ciypgs/edit?pli=1#gid=1364064522"">bednets</a> and <a href=""https://docs.google.com/spreadsheets/d/1McptF0GVGv-QBlhWx_IoNVstWvt1z-RwVSu16ciypgs/edit?pli=1#gid=385523701"">seasonal malaria chemoprevention</a> and <a href=""https://docs.google.com/spreadsheets/d/1McptF0GVGv-QBlhWx_IoNVstWvt1z-RwVSu16ciypgs/edit?pli=1#gid=675486926"">vitamin A supplementation</a> all can save lives for (low) single digit thousands of dollars and have substantial funding gaps remaining. We tend to place much more weight on GiveWell&rsquo;s figures than other sources, but estimates in this range are not unusual; <a href=""https://www.gavi.org/about/mission/facts-and-figures/"">Gavi</a> (<a href=""https://web.archive.org/web/20190702022141/https://www.gavi.org/about/mission/facts-and-figures/"">archive</a>) and <a href=""https://www.theglobalfund.org/en/news/2018-09-12-global-fund-partnership-has-saved-27-million-lives/"">the Global Fund</a> (<a href=""https://web.archive.org/web/20190702022233/https://www.theglobalfund.org/en/news/2018-09-12-global-fund-partnership-has-saved-27-million-lives/"">archive</a>) make similar claims (not <a href=""http://sites.bu.edu/neudc/files/2014/10/paper_400.pdf"">without</a> (<a href=""https://web.archive.org/web/20190702022320/http://sites.bu.edu/neudc/files/2014/10/paper_400.pdf"">archive</a>) <a href=""https://www.thelancet.com/journals/lancet/article/PIIS0140-6736(18)33055-1/fulltext"">controversy</a>) (<a href=""https://web.archive.org/web/20190702022344/https://www.thelancet.com/journals/lancet/article/PIIS0140-6736(18)33055-1/fulltext"">archive</a>).</li>
	<li>Standard &ldquo;value of a statistical life&rdquo; methods in <a href=""https://en.wikipedia.org/wiki/Value_of_life#United_States"">the U.S. and other rich countries</a> imply values in the (high) single digit millions of dollars. For instance, the U.S. Department of Transportation uses a value of <a href=""https://cms.dot.gov/sites/dot.gov/files/docs/2016%20Revised%20Value%20of%20a%20Statistical%20Life%20Guidance.pdf"">$9.6 million for a statistical life</a> (<a href=""https://web.archive.org/web/20190702022456/https://cms.dot.gov/sites/dot.gov/files/docs/2016%20Revised%20Value%20of%20a%20Statistical%20Life%20Guidance.pdf"">archive</a>), which is on the high side relative to other estimates.</li>
	<li>If we value the lives of children saved by GiveWell&rsquo;s global health charities the same way the DOT values lives lost in car crashes in the U.S., we would estimate ~5,000x returns ($9.6M benefit/~$2K cost per life saved equivalent).</li>
</ul>

<p>To be clear, this calculation violates the standard assumptions of value of a statistical life, one of which is that the value of a life depends on the income of a person who lives it, and is not endorsed by GiveWell (which has a more complicated moral weights system for comparing outcomes).</p>
|<p>Since this post was first written, we came across <em><a href=""https://onlinelibrary.wiley.com/doi/abs/10.1111/j.1539-6924.1995.tb00330.x"">Five-Hundred Life-Saving Interventions and Their Cost-Effectiveness</a></em> (<a href=""https://web.archive.org/web/20190707210931/https://onlinelibrary.wiley.com/doi/abs/10.1111/j.1539-6924.1995.tb00330.x"">archive</a>).</p>
|<p>When we looked closely at one of the calculations in the the DCP2, <a href=""https://blog.givewell.org/2011/09/29/errors-in-dcp2-cost-effectiveness-estimate-for-deworming/"">we found serious errors</a>. We haven&rsquo;t looked closely at the other sources at all. Overall, we expect the project of trying to estimate the cost-effectiveness of many different interventions in uniform terms to be extremely difficult and error-prone, so we don&rsquo;t mean to endorse these specific estimates.</p>
|<p>Some discussion of this in <a href=""https://blog.givewell.org/2011/09/29/errors-in-dcp2-cost-effectiveness-estimate-for-deworming/#comment-236968"">the comments</a> of GiveWell&rsquo;s 2011 post on errors in the DCP2.</p>
","9/7/2019 17:14:00"
